TitleName,Sales,Series,Platform(s),Initial release date,Developer(s),Publisher(s),Artwork,Video,Summary
Grand Theft Auto IV,25000000,Grand Theft Auto,Multi-platform,2008-04-29,Rockstar North,Rockstar Games,https://upload.wikimedia.org/wikipedia/en/b/b7/Grand_Theft_Auto_IV_cover.jpg,https://youtu.be/M80K51DosFo,"""Grand Theft Auto IV is an action-adventure video game developed by Rockstar North and published by Rockstar Games. It is the eleventh title in the Grand Theft Auto series, and the first main entry since 2004's Grand Theft Auto: San Andreas.
             

              The game is played from a third-person perspective and its world is navigated on-foot or by vehicle. Throughout the single-player mode, players play as Niko Bellic. An online multiplayer mode is included with the game, allowing up to 32 players to engage in both co-operative and competitive gameplay in a recreation of the single-player setting.
             

              Two expansion packs were later released for the game, The Lost and Damned and The Ballad of Gay Tony, which both feature new plots that are interconnected with the main Grand Theft Auto IV storyline, and follow new protagonists."""
Pokémon Diamond / Pearl / Platinum,24730000,Pokémon,Nintendo DS,2006-09-28,Game Freak,Nintendo,https://upload.wikimedia.org/wikipedia/en/c/ca/Pokemon_Platinum.png,https://youtu.be/r4StxwFogLY,"""In Pokémon Platinum another world has emerged in the Sinnoh Region, a world where space and time are altered! Catch, train, and battle your favorite Pokémon, and discover ancient, mythical Pokémon in this exciting adventure! The platinum version also has expanded online options with new experiences in the Wi-Fi Plaza and Battle Frontier!"""
Super Mario Bros. 3,24430000,Super Mario,Multi-platform,1988-10-23,Nintendo EAD,Nintendo,https://upload.wikimedia.org/wikipedia/en/a/a5/Super_Mario_Bros._3_coverart.png,https://youtu.be/seZM0HHPIdo,"""Super Mario Bros. 3, the third entry in the Super Mario Bros. series and Super Mario franchise, sees Mario or Luigi navigate a nonlinear world map containing platforming levels and optional minigames and challenges. The game features more diverse movement options and new items alongside more complex level designs and boss battles."""
Super Mario Odyssey,24400000,Super Mario,Nintendo Switch,2017-10-27,Nintendo EPD,Nintendo,https://upload.wikimedia.org/wikipedia/en/8/8d/Super_Mario_Odyssey.jpg,https://youtu.be/wGQHQc_3ycE,"""Explore incredible places far from the Mushroom Kingdom as you join Mario and his new ally Cappy on a massive, globe-trotting 3D adventure. Use amazing new abilities, like the power to capture and control objects, animals, and enemies to collect Power Moons so you can power up the Odyssey airship and save Princess Peach from Bowser’s wedding plans!"""
Call of Duty: Black Ops II,24200000,Call of Duty,Multi-platform,2012-11-12,Treyarch,Activision,https://upload.wikimedia.org/wikipedia/en/0/05/Call_of_Duty_Black_Ops_II_box_artwork.png,https://youtu.be/x3tedlWs1XY,"""Black Ops II is the first game in the Call of Duty franchise to feature future warfare technology and the first to present branching storylines driven by player choice as well as selecting weapons before starting story mode missions."""
FIFA 18,24000000,FIFA,Multi-platform,2017-09-29,EA Vancouver,EA Sports,https://upload.wikimedia.org/wikipedia/en/d/d4/FIFA18cover.png,https://youtu.be/z_7Gz_RFLnE,"""FIFA 18 is a sports association football simulation video game developed by EA Canada and published by Electronic Arts."""
Kinect Adventures!,24000000,None,Xbox 360,2010-11-04,Good Science Studio,Xbox Game Studios,https://upload.wikimedia.org/wikipedia/en/0/04/Kinect_Adventures_cover.jpg,https://youtu.be/iK_UlfO42sc,"""A collection of five adventure and sports minigames that utilizes the Kinect motion camera and was offered as a pack-in game with the console. The game uses full-body motion to allow the player to engage in minigames, all of which feature jump-in, jump-out multiplayer play."""
Sonic the Hedgehog,23982960,Sonic the Hedgehog,Multi-platform,1991-06-23,Sonic Team,Sega,https://upload.wikimedia.org/wikipedia/en/b/ba/Sonic_the_Hedgehog_1_Genesis_box_art.jpg,https://youtu.be/JqQYDLcvkBc,"""Sonic the Hedgehog is a 2D, side-scrolling platformer, whose gameplay centers around Sonic's ability to run at high speed through levels incorporating springs, slopes, high falls, and loop-the-loops. The levels contain hazards in the form of robots (""badniks"" in the Western game manuals) in which Dr. Robotnik has trapped animals. Although destroying a robot frees the animal within, this is not required to complete the game. The player must avoid rows of sharp spikes, falling into bottomless pits, being crushed by moving walls or platforms, and drowning (which can be avoided by breathing air bubbles periodically released from vents). Sonic's main attack is his spin, where he curls into a ball and rotates rapidly (damaging enemies and some obstacles). This can be performed by jumping in the air or rolling on the ground.
             

              Scattered around each level map are gold rings and collecting 100 rings rewards the player with an extra life. Rings are a layer of protection against hazards; if Sonic has at least one ring when he collides with an enemy, he will survive. However, all his rings will be scattered; they will flicker and disappear in a few seconds if they are not picked up again. If Sonic is hit without any rings, he loses a life. Although shields and temporary invincibility may be collected to provide additional protection, certain hazards (such as drowning, being crushed, falling down a bottomless pit or running out of time) will cost Sonic a life regardless of rings or other protection.
             

              The game is divided into six zones (Green Hill, Marble, Spring Yard, Labyrinth, Star Light, and Scrap Brain), each with its own visual style and enemies. A player must navigate through each zone (subdivided into three acts) to progress.
             

              At the end of each zone's third act, the player confronts Dr. Robotnik (who pilots a different vehicle each time) in a boss fight. After the sixth zone, the player continues directly to the Final Zone for a last encounter with Robotnik. They begin with three lives (power-ups and rings add more), which are lost when Sonic collides with hazardous enemies (or objects) without rings, falls off-screen or exceeds an act's ten-minute time limit. Lampposts acting as checkpoints allow Sonic to return to the most-recently activated post when he loses a life. If he loses a life as a result of time running out but has another life, the timer will reset to 0:00 when he returns to the checkpoint. If all lives are lost at any point in the game, the game over screen will appear (when the player can return to the beginning of the act with three lives, if they have any continues).
             

              When Sonic reaches the end of act one or act two of a zone with at least fifty rings, a large ring appears through which he can jump to enter a Special Stage (a ""Secret Zone"" in the original Genesis manual). In each of six Special Stages, Sonic bounces off the bumpers and walls of a rotating maze in spin attack. Although the player earns a continue with each 50 rings found, their main goal is to obtain the Chaos Emerald at the end of the maze without colliding with a ""goal block"" (which ends the level)."""
Nintendogs,23960000,None,Nintendo DS,2005-04-21,Nintendo EAD,Nintendo,https://upload.wikimedia.org/wikipedia/en/8/82/Dalmatianfriends.jpg,https://youtu.be/yRTca2LXTLM,"""Nintendogs is a franchise of pet-simulation games developed by Nintendo of Japan in early 2005. It enables players to take care of their own digital dogs and encourages fun, responsible dog ownership through use of the real-time clock to simulate hunger, thirst and so forth."""
Mario Kart DS,23600000,Mario Kart,Nintendo DS,2005-11-14,Nintendo EAD,Nintendo,https://upload.wikimedia.org/wikipedia/en/8/86/Mario_Kart_DS_cover.jpg,https://youtu.be/Zy41U69D6Lc,"""Mario Kart DS is the continuation of the long running racing game series that began on the Super Nintendo. It features 16 new tracks as well as 16 tracks from the previous 4 games, with each set split up into the Nitro and Retro Grand Prix respectively. Eight racers are initially available, each with two go-karts to choose from. A number of characters and additional karts are also available to unlock. New items have been added to the arsenal, including a Blooper squid that squirts ink onto the screens of other players and a Bullet Bill power up that transforms the player into a giant, fast-travelling bullet on autopilot."""
God of War,23000000,God of War,PlayStation 4 / Windows,2018-04-20,Santa Monica Studio,Sony Interactive Entertainment,https://upload.wikimedia.org/wikipedia/en/a/a7/God_of_War_4_cover.jpg,https://youtu.be/K0u_kAWLJOA,"""God of War is the sequel to God of War III as well as a continuation of the canon God of War chronology. Unlike previous installments, this game focuses on Norse mythology and follows an older and more seasoned Kratos and his son Atreus in the years since the third game. It is in this harsh, unforgiving world that he must fight to survive… and teach his son to do the same."""
Red Dead Redemption,23000000,Red Dead,PS3 / Xbox 360,2010-05-18,Rockstar San Diego,Rockstar Games,https://upload.wikimedia.org/wikipedia/en/a/a7/Red_Dead_Redemption.jpg,https://youtu.be/-o7rES_3ymA,"""A modern-day Western epic, Red Dead Redemption takes John Marston, a relic from the fast-closing time of the gunslinger, through an open-world filled with wildlife, mini games and shootouts. Marston sets out to hunt down his old gang mates for the government, who have taken away his family, and meets many characters emblematic of the Wild West, heroism and the new civilization along his journey."""
Call of Duty: Modern Warfare 2,22700000,Call of Duty,Multi-platform,2009-11-10,Infinity Ward,Activision,https://upload.wikimedia.org/wikipedia/en/5/52/Call_of_Duty_Modern_Warfare_2_%282009%29_cover.png,https://youtu.be/blshENwbHgs,"""Call of Duty: Modern Warfare 2 is a first-person shooter video game developed by Infinity Ward and published by Activision for the Xbox 360 and PlayStation 3 video game consoles and the Microsoft Windows operating system. Officially announced on February 11, 2009, the game was released worldwide on November 10, 2009. It is the sixth installment of the Call of Duty series and the direct sequel to Call of Duty 4: Modern Warfare, continuing the same storyline, with Call of Duty: Modern Warfare 3 set to end the storyline."""
